{"$id":"urn:hivehub:schema:dial-record:1","$schema":"https://json-schema.org/draft/2020-12/schema","additionalProperties":false,"properties":{"adapter_registration_address":{"pattern":"^urn:hivehub:sha256:[0-9a-f]{64}$","type":"string"},"chants":{"items":{"maxLength":4096,"minLength":1,"type":"string"},"maxItems":256,"type":"array","uniqueItems":true},"description":{"type":"string"},"id":{"pattern":"^urn:hivehub:sha256:[0-9a-f]{64}$","type":"string"},"kind":{"const":"dial-record"},"learning_bundle_address":{"pattern":"^urn:hivehub:sha256:[0-9a-f]{64}$","type":"string"},"name":{"maxLength":4096,"minLength":1,"type":"string"},"protocol_fingerprint":{"pattern":"^urn:hivehub:sha256:[0-9a-f]{64}$","type":"string"},"schema_version":{"const":1},"urls":{"items":{"maxLength":4096,"minLength":1,"type":"string"},"maxItems":256,"type":"array"},"visibility":{"enum":["local","public","private"]}},"required":["kind","schema_version","id","name","description","visibility","protocol_fingerprint","learning_bundle_address","adapter_registration_address","urls","chants"],"title":"dial-record","type":"object"}
