{"adapter_registration_address":"urn:hivehub:sha256:10d6e5bd624b849862f9be7f86d2a780333aec8d42a968eff7ebc8d789daf45d","chants":["firefly commons"],"description":"A generic public Hive using the Firefly Mesh protocol.","id":"urn:hivehub:sha256:c2e7c9e776480048453ccde30365cd72de97731ed530cdc19724bc635ac5636e","kind":"dial-record","learning_bundle_address":"urn:hivehub:sha256:c035ec045e02479c087d6f46f25be77a4ee3eb2ca502b200d659c95be5f2c860","name":"Firefly Commons","protocol_fingerprint":"urn:hivehub:sha256:92299f6ce3a2c80ea3f80810c74dc208748b413167dbbbefeae6ece427a05367","schema_version":1,"urls":["https://firefly.invalid/hives/commons"],"visibility":"public"}
