{"adapter_registration_address":"urn:hivehub:sha256:baf9e27c50f4c517ed7d42fd573a96bcd980cf0eb785ade8fe9a6a095a05b5b2","chants":[],"description":"Synthetic folder Hive (hive-md, experimental) from kody-w/rapp-model-hive at commit 2bd7c95, founded by Avery with a public test key. It is a published snapshot with no live shared copy: its address uses the reserved .invalid domain and resolves nowhere. Read its reviewed public copy instead.","id":"urn:hivehub:sha256:cae090f776640d5391cf085697feb2fe24dd3d3a34b3fa9096672a6c7ac8c5e1","kind":"dial-record","learning_bundle_address":"urn:hivehub:sha256:166b356b000756f1f45aa9aac12151dff8374cd4bc62c801177c50deb1bc3373","name":"Contoso Onboarding (model Hive)","protocol_fingerprint":"urn:hivehub:sha256:6f6cb57893764dad9311813ed5d08d1a8788c1c0334e0382cd41901d7b0bafc5","schema_version":1,"urls":["https://contoso.invalid/hives/contoso-onboarding.git","https://github.com/kody-w/rapp-model-hive/tree/2bd7c95152ede719b6418b80e2bdc2cd457bf711/example/contoso-onboarding-public"],"visibility":"public"}
